{
  "library_name": "debugging_case_library",
  "version": "0.2.0",
  "description": "Curated debugging cases for common Python and JavaScript runtime and validation errors.",
  "cases": [
    {
      "id": "python-index-error",
      "title": "List index out of range",
      "language": "python",
      "error_category": "indexing",
      "status": "verified_human",
      "problem_description": "The code accesses a list position that does not exist.",
      "example_code": "numbers = [1, 2, 3]\nprint(numbers[3])",
      "error_message": "IndexError: list index out of range",
      "explanation": "Python lists are zero-indexed. If the list has three elements, the valid indices are 0, 1, and 2. The code tries to access index 3, which is outside the valid range.",
      "suggested_correction": "Use a valid list index or check the list length before reading an element.",
      "verification_steps": [
        "Run the corrected program.",
        "Confirm the code accesses an index that exists.",
        "Check the expected value is returned without crashing."
      ],
      "source": "Python official documentation and common beginner debugging patterns."
    },
    {
      "id": "python-type-error",
      "title": "Unsupported operand type(s) for +: 'int' and 'str'",
      "language": "python",
      "error_category": "type_mismatch",
      "status": "verified_human",
      "problem_description": "The code tries to combine variables of incompatible types.",
      "example_code": "age = 25\nmessage = 'Your age is: ' + age",
      "error_message": "TypeError: can only concatenate str (not \"int\") to str",
      "explanation": "The expression combines a string and an integer with the + operator. Python cannot implicitly convert the integer to a string in this context.",
      "suggested_correction": "Convert the integer to a string before concatenating, or format the output with f-strings.",
      "verification_steps": [
        "Fix the type mismatch.",
        "Run the code and confirm the output is a valid string.",
        "Verify that no TypeError is raised."
      ],
      "source": "Python type system and common runtime error examples."
    },
    {
      "id": "python-name-error",
      "title": "NameError: variable is not defined",
      "language": "python",
      "error_category": "undefined_variable",
      "status": "verified_human",
      "problem_description": "The program references a variable before it has been defined or outside its scope.",
      "example_code": "print(message)\nmessage = 'hello'",
      "error_message": "NameError: name 'message' is not defined",
      "explanation": "The variable is referenced before it is created. In Python, variables must be defined before they are used in the current scope.",
      "suggested_correction": "Define the variable before using it or ensure the variable is in the correct scope.",
      "verification_steps": [
        "Move the variable definition before the print call.",
        "Run the script again.",
        "Validate that the output is expected and no NameError appears."
      ],
      "source": "Python variable scoping and execution order."
    },
    {
      "id": "python-value-error",
      "title": "Invalid literal for int() with base 10",
      "language": "python",
      "error_category": "invalid_input",
      "status": "verified_human",
      "problem_description": "The program tries to convert a non-numeric string into an integer.",
      "example_code": "value = int('abc')",
      "error_message": "ValueError: invalid literal for int() with base 10: 'abc'",
      "explanation": "The int() function expects digits only. A string such as 'abc' cannot be converted to an integer without a custom parsing rule.",
      "suggested_correction": "Validate the input before conversion and handle invalid user input explicitly.",
      "verification_steps": [
        "Validate the input string before calling int().",
        "Run the code with valid data and invalid data.",
        "Check that invalid input triggers a controlled error message instead of crashing."
      ],
      "source": "Python conversion errors and input validation practices."
    },
    {
      "id": "python-attribute-error",
      "title": "AttributeError: 'str' object has no attribute 'append'",
      "language": "python",
      "error_category": "attribute_mismatch",
      "status": "verified_human",
      "problem_description": "The code calls a method that does not exist on the current object type.",
      "example_code": "text = 'hello'\ntext.append(' world')",
      "error_message": "AttributeError: 'str' object has no attribute 'append'",
      "explanation": "Strings do not have an append method. The code is trying to use a list-like operation on a string, which is not supported.",
      "suggested_correction": "Use the correct operation for the object type, such as string concatenation or a list if appending is required.",
      "verification_steps": [
        "Check the object type before calling the method.",
        "Use the correct operation for strings or lists.",
        "Confirm the behavior matches the intended data structure."
      ],
      "source": "Python object types and attribute access behavior."
    },
    {
      "id": "python-none-handling",
      "title": "NoneType has no attribute or invalid output",
      "language": "python",
      "error_category": "missing_value",
      "status": "verified_human",
      "problem_description": "A value is missing or null-like and is later used as if it were a valid object.",
      "example_code": "profile = None\nprint(profile.name)",
      "error_message": "AttributeError: 'NoneType' object has no attribute 'name'",
      "explanation": "The variable profile is set to None, which means there is no object behind it. The code assumes a valid object and tries to access a property that does not exist.",
      "suggested_correction": "Guard against missing values and return a sensible fallback before dereferencing the object.",
      "verification_steps": [
        "Check whether the value is None before using it.",
        "Handle the missing case explicitly.",
        "Verify the fallback behavior in user-facing code paths."
      ],
      "source": "Null and missing-value handling in Python applications."
    },
    {
      "id": "javascript-type-error",
      "title": "Cannot read properties of undefined",
      "language": "javascript",
      "error_category": "null_or_undefined",
      "status": "verified_human",
      "problem_description": "The code tries to access a property on an undefined value.",
      "example_code": "const user = undefined;\nconsole.log(user.name);",
      "error_message": "TypeError: Cannot read properties of undefined (reading 'name')",
      "explanation": "The variable user is undefined, so it does not contain an object with a name property. JavaScript cannot read a property from an undefined value.",
      "suggested_correction": "Check whether the object exists before reading its properties, or initialize the object with a default value.",
      "verification_steps": [
        "Guard the access with a null or undefined check.",
        "Run the script.",
        "Confirm that the code handles the missing object safely."
      ],
      "source": "JavaScript runtime behavior for undefined and null properties."
    },
    {
      "id": "javascript-reference-error",
      "title": "Variable not defined",
      "language": "javascript",
      "error_category": "undefined_variable",
      "status": "verified_human",
      "problem_description": "The code references a variable that has not been declared in the current scope.",
      "example_code": "console.log(totalAmount);\nconst totalAmount = 42;",
      "error_message": "ReferenceError: totalAmount is not defined",
      "explanation": "The script accesses totalAmount before it is declared. In JavaScript, a variable declared with const or let is not available before initialization in the same scope.",
      "suggested_correction": "Declare the variable before it is used, or move the logic so the value is created before the access.",
      "verification_steps": [
        "Declare the variable before the log statement.",
        "Run the program again.",
        "Check that the console output matches the expected value."
      ],
      "source": "JavaScript scope and temporal dead zone behavior."
    },
    {
      "id": "javascript-null-handling",
      "title": "Cannot read properties of null",
      "language": "javascript",
      "error_category": "null_or_undefined",
      "status": "verified_human",
      "problem_description": "The code dereferences a null value expecting an object or array.",
      "example_code": "const config = null;\nconsole.log(config.timeout);",
      "error_message": "TypeError: Cannot read properties of null (reading 'timeout')",
      "explanation": "The configuration object is null, so the code cannot access a property on it. The fix is to guard against null before reading properties.",
      "suggested_correction": "Check for null before reading properties or provide a default fallback object.",
      "verification_steps": [
        "Add a null guard before reading timeout.",
        "Run the code with and without config.",
        "Confirm that the default fallback is used safely."
      ],
      "source": "JavaScript null handling and defensive coding patterns."
    },
    {
      "id": "javascript-malformed-request",
      "title": "Malformed request payload",
      "language": "javascript",
      "error_category": "invalid_input",
      "status": "verified_human",
      "problem_description": "The application receives a payload without the required field, causing a downstream failure.",
      "example_code": "const payload = { name: 'Alice' };\nconst age = payload.age.toString();",
      "error_message": "TypeError: Cannot read properties of undefined (reading 'toString')",